{"algorithm":"reproassert-v021-preparation-freeze-v1","benchmark_protocol":"0.2","claims":{"campaign_readiness_changed":false,"historical_artifacts_rewritten":false,"model_or_provider_invoked":false,"provider_calls":0,"results_changed":false},"cohort":{"case_count":20,"cohort_plan_path":"benchmarks/v0.2-draft/leak-audited-cohort-plan.json","cohort_plan_sha256":"bc948ca82d260da9fb2678032f2172d6f2d1b43fe6df438b1d8d380a1a45818f","selection_changed":false},"freeze_revision":"0.2.1","freeze_sha256":"1d44f91bbdc33d9518bcadd6c62e8561be8b03126672089cdb46170352db6ec9","frozen_at":"2026-07-11T05:37:59Z","parser":{"archive_bytes":92300454,"archive_name":"reproassert-dataset-parser-0.2.1-linux-arm64.tar.gz","archive_sha256":"7dc1c4e4d6bae1c57ba3dba65f29600437eac37e1f5a26f75e08c7867ede44fd","boundary_attestation":{"path":"benchmarks/v0.2-draft/dataset-parser-boundary-attestation-v0.2.1.json","sha256":"19bdf12320fff2a7f40835afa75384558c97b263b66df87e684d915a6c0adf05"},"boundary_attestation_status":"fresh_private_rederivation_verified","image_id":"sha256:fea2f964d148f59c18662a802a0ffa27aff9be5475d8111291ef4c94f9b48cdf","parser_receipt_sha256":"67f337d762536333e06821e91cc1a85dc37ae2b86c14af26057cd090685f96ae","platform":"linux/arm64","replaces_unrecoverable_image_id":"sha256:0bf07669fd085b608e6859b90a486b3ede52d8cc409309410181ab32fbe1118f"},"schema_version":"1.0.0","status":"successor_image_frozen_preparation_unrun","supersedes":{"dataset_parser_boundary_attestation":{"path":"benchmarks/v0.2-draft/dataset-parser-boundary-attestation.json","sha256":"4fc2b282fad53792319cf3baa19c3a24b28d2f12c7b3e6f40cbe931012030a87"},"selection_freeze":{"path":"benchmarks/v0.2-draft/selection-freeze.json","sha256":"7fcba5b043d75e0bba1376c92ee0f2071915b672b15472772a174eda1f87ffb2"}}}
